{"adapters":[{"adapter_id":"consejo_judicatura","asset":"cntr-rpa-adapter-consejo_judicatura-0.1.7-candidate-win-x64.zip","contract_version":1,"engine_major":1,"entrypoint":"src/adapter.py","files":{"adapter-manifest.json":"3afe8591b79dda4b6ce5d04ecbd23c09c03273f7e782bda3a2368d54d2c07b64","app.py":"b6e47aa30e82a1d8353b9e2c1ec26477f9a3615ccc45a41369cc33460b0d32b4","dependencies.lock":"a9f05bdc9abe9732206ab2a3302960d94d773e489e3c047930925bff2f807077","src/adapter.py":"777d410d817e8e33fdb24be96f7e65b718c29f30322251836d5aed9caf7d92e4"},"platform":"windows-x64","release_tag":"cntr-rpa-judicatura-0.1.7-prod1","sha256":"3f9d3bb213c0290be07c9151fa5680b6975701bc20a0728379bfdb40e37ec33c","signature":"6cDIx2wk0q8k04ldbfuvVU4TpqIYaWnXL2d9eO7JNOAskQ5dfSv4LYx5WX3JYWcSZcIEd0OsiXC2HJwArLrkAA==","size":10110,"source_commit":"36f16412b56d34aadf0dbc8c6d631593395fa936","version":"0.1.7-candidate"},{"adapter_id":"fiscalia","asset":"cntr-rpa-adapter-fiscalia-0.1.4-candidate-win-x64.zip","contract_version":1,"engine_major":1,"entrypoint":"adapter.py","files":{"adapter-manifest.json":"bd0186d3aae903e5f00b9991a1614a29bcf17c49fca618636142784cf1a5dc10","adapter.py":"57a3713618edeb675ac0dd4519ab85594b89b17e95613311ed5324b83d1dca8c","app.py":"13a8f948b4fda6c6540f1bed7ff33d1eee4a0f8de33cb1a25c577daf34e42f8f","dependencies.lock":"19e271c3fd062130440450e812fcec6b8c1abe26b3132e4552319c79f6d9ee04"},"platform":"windows-x64","release_tag":"cntr-rpa-fiscalia-0.1.4-prod1","sha256":"62224226f18dfa9ce16f8f9b4ead0e69cd6ca68d0b3c72331a5654d5780ee19f","signature":"v86jYqNKLmYjP1ScU/Tn3u2c4Wq8ZPId+JNmHRMMB55nL689BuMNNW1vu4ozpDsxyWvFmRcYhZLVoJumZuAIDw==","size":7717,"source_commit":"632937626ad3e3609d63361abdb9e15417fd8ab3","version":"0.1.4-candidate"},{"adapter_id":"iess","asset":"cntr-rpa-adapter-iess-0.1.6-win-x64.zip","contract_version":1,"engine_major":1,"entrypoint":"adapter.py","files":{"adapter-manifest.json":"2c7e2f4d99eb66e7412bb0de1028021f78e9a84172af10a9e0329f11c8e9c3d5","adapter.py":"2ed7c761acdd40bd2006cec11f6cbc50e6d9e6afd729e32c9ae559f213bfcee1","app.py":"b14a44e44b6d8963b804b6d0c66530d94be85093c169a9c0230f965c27f9043e","dependencies.lock":"f7ec55abdbd6df0a090db3ddc824962425e37f18893b1a1e86800dcbc7df42e3","documents/documento_2.py":"e16694a32408a5851288cd34ef4ce1a862b23a05db3019a21f01752e27745b63"},"platform":"windows-x64","release_tag":"cntr-rpa-iess-0.1.6","sha256":"905ac218dc7892189b9d59e303362bfc487b2e829767af477671e630c4e210ea","signature":"9O6Zr5aQVVsxiSpXYjsJDek3xbYp0ZKT9OHvDZrgUS6taDIXoLsD0ri6mY5qQvXWlISrY0FswoFX97wGzSVBBQ==","size":6487,"source_commit":"b079040098a125369f23a4c802e622975e9a5020","version":"0.1.6"},{"adapter_id":"ministerio_interior","asset":"cntr-rpa-adapter-ministerio_interior-0.1.1-candidate-win-x64.zip","contract_version":1,"engine_major":1,"entrypoint":"adapter.py","files":{"adapter-manifest.json":"892a24ea79f0e2c511d832dad98db2607f5c1e7de923a7bfb09fe567bbf02e11","adapter.py":"cb862dc65bd568280ba16c0b29e312e3f50da07a925ae26e007e85b807f351e3","app.py":"e275696ebce4f3f63227a2c75af5da3e434e794b892a754800ecdcc5fdbafc9b","dependencies.lock":"19e271c3fd062130440450e812fcec6b8c1abe26b3132e4552319c79f6d9ee04"},"platform":"windows-x64","release_tag":"cntr-rpa-ministerio_interior-0.1.1-prod1","sha256":"ed9e58ffe14cd2ea649e6e753078c9167d2f22badff22340b102ab3cd6e3e44d","signature":"SqxkVwUvo89wphDDulXYIjCsbWdDjCr0xF9ifPnkdZa4bSzbpEFIO9wp9Y5wApBa+mfDrYoCtdB45fRHlm1wAw==","size":11371,"source_commit":"632937626ad3e3609d63361abdb9e15417fd8ab3","version":"0.1.1-candidate"},{"adapter_id":"ofac","asset":"cntr-rpa-adapter-ofac-0.2.4-win-x64.zip","contract_version":1,"engine_major":1,"entrypoint":"src/adapter.py","files":{"adapter-manifest.json":"e87ad2a2bc019467f1aeb22df941cb622a41a7d0eea140f06097413514f5f1e5","app.py":"8a3f8d66107af98f5f54cedf627093ef11bb0b548cd525519cff51bc1931b08c","dependencies.lock":"68f3925723a8136c3363245687738892b9c15be7444cc32a417d33ddc02e703f","documents/__init__.py":"1c151fd7d047091d4bd47982e66f3c0026a897f778dae981781bd4a183896f13","documents/documento_33.py":"1e51798d41ccb3f9b72a7f6a5a67fd044343f806db738c22370adb0e5525d647","documents/documento_5.py":"52bb3e12b11b9c670aedca238606fdb7c626fe5d40cb30a8d168b161974cf198","documents/vendor/fitz/__init__.py":"23dae7eac8bbdcae7fc175de7fa168b849c25b6fec1a7196a7a9e9f6141a372f","documents/vendor/fitz/table.py":"8ab84abc4a59ff83cdfbe4c95ccdaf6eb4ac438415bdee3747d0b2d8a65e2713","documents/vendor/fitz/utils.py":"4e72ca23d6bad3e263113f4a8fda7b1a5e0ca00be96847031bd64fef2c2fa130","documents/vendor/pymupdf-1.28.0.dist-info/COPYING":"40e60697600535eabfb5ae05f72829d88cfe8d02dd4792f5a754f6f51dabe55b","documents/vendor/pymupdf/__init__.py":"16929dab87b4e55c2b2cb1a9eb3ab947c6335c203edc31723af480cfa22903b5","documents/vendor/pymupdf/__main__.py":"763a97305937d0665a43d4b6920924efb15d8f87795ec2926c09f9da69bfd2cb","documents/vendor/pymupdf/_apply_pages.py":"720b52015d70320bb3603c1a724c0741c9b53e87a9943ec96a911ef38b5bd457","documents/vendor/pymupdf/_build.py":"c9d8a6282b321d9bb9588f6197b4756e0bf43b7fa76dc0fc543bef0429d7d2bf","documents/vendor/pymupdf/_extra.pyd":"2f40b8c8c1ea0e76e3443f1c7b0cc7830dac61667537ce4c6bc92d495a5a94d8","documents/vendor/pymupdf/_mupdf.pyd":"000d93f313bd541de0a302e3c17b8a4ce51afe788c6062b225b2d02d52cea7ec","documents/vendor/pymupdf/_wxcolors.py":"02363faab89d46857e25e7ca88707ca2975d36754a4fa9fd1d15081fc523ac1d","documents/vendor/pymupdf/extra.py":"1888affc6f914edef4730c87bcb19849d5f10c9f65334fd329e728565a9980a3","documents/vendor/pymupdf/mupdf.py":"1a3303ca783c5df8587b664574312b59d224bea2eacf020e5209f071a4cd3553","documents/vendor/pymupdf/mupdfcpp64.dll":"6d26bbdcbbb2489fd1343a7f317aecd5614243b98d6db5c3776db170a6edfea7","documents/vendor/pymupdf/pymupdf.py":"4e6040168b78f7ddf96f6ce4b0ddb59e6702a979b55704e62c38b9b430596352","documents/vendor/pymupdf/table.py":"fde260d7c885eae39c65766107c80016956c4a91a9cd19eb82b64a724daf90b6","documents/vendor/pymupdf/utils.py":"cc172067fe277068a3abdb9c8886efbfacaabc9b261f82ecb686ecd85fb7622d","documents/vendor/pypdf/LICENSE":"a97ac230e5f33ef10a5367a850eb01f91f1a0b064e34742c7794d2294557f524","documents/vendor/pypdf/__init__.py":"16f7b97e0c8f56d9c4d05d07157014e27527eb46cd7a1a97af14133f859dd186","documents/vendor/pypdf/_cmap.py":"9add400d631f532ac0e19fe449d8a360e64cd400515f71fceb73ad6c8af4fa90","documents/vendor/pypdf/_codecs/__init__.py":"597324ce53020e5986e54ea2c5093c32b631690789c447e28390d368696494b9","documents/vendor/pypdf/_codecs/_codecs.py":"a9164cad49135d44ed7390b14584ee6a4f8b9975e093ec8ba65d4616a843c770","documents/vendor/pypdf/_codecs/adobe_glyphs.py":"b7770314f0eac08cf5c3d07481d5738dd73c7842bd02e4639397fb95a130fdf6","documents/vendor/pypdf/_codecs/pdfdoc.py":"c5f4af30562cbf1b9a490d14bbdbd90ca681d16bbce61d6e0a20758bdac07145","documents/vendor/pypdf/_codecs/std.py":"0f240cb84a40184a52f6ecb58d67f87278fe92a4a13ce0228f9b08ed0d580fc1","documents/vendor/pypdf/_codecs/symbol.py":"9c86864089615822623cc1ebc149661871fefdf397c842af82e466b8a5dc1809","documents/vendor/pypdf/_codecs/zapfding.py":"3d0c63c510bad7a778d711777b15713f55bc9cce10ad97e33b7966b4bc6913fb","documents/vendor/pypdf/_crypt_providers/__init__.py":"2b767a02e5e15d579780b7adf93ba4ab682df47eba3a076ea6cbf1212d429a42","documents/vendor/pypdf/_crypt_providers/_base.py":"fdfe77323eaf8af84464c438bcdc4de46d083a0158fa7e7f95e91ed1cfea88d5","documents/vendor/pypdf/_crypt_providers/_cryptography.py":"cd3dd699b3f37acbe01d190670a02576a276e0c6370706558956d2739e59c61c","documents/vendor/pypdf/_crypt_providers/_fallback.py":"bec628a30475602015feaf87add21986451cac26fa1ef44134c626d3742d094f","documents/vendor/pypdf/_crypt_providers/_pycryptodome.py":"53569067d89806b668fa12828c952118e3e1c04153a228ada30437d7a4cdaeb0","documents/vendor/pypdf/_doc_common.py":"0a442c0528e4c858f34680e76cecbdd3b2b0066ab358f771037f24a349e4c6cf","documents/vendor/pypdf/_encryption.py":"a4f83b7c87ea74bf7a4dce91568072b4456332b99915e72bffa97b75bb4316b1","documents/vendor/pypdf/_merger.py":"61f4902838a2433d96b42995663c4ffe7bf6a51dac86205fdad0e201be3573bb","documents/vendor/pypdf/_page.py":"7d41ab88c6e159fc1c84247b2d1501f1b79322cf3bf8fe553c8d6729fe65bcf1","documents/vendor/pypdf/_page_labels.py":"7003d95f35d0db82e9a1a8654cdc55b6e8fc46be0073338a7344a5c955578e66","documents/vendor/pypdf/_protocols.py":"9e8135cb67d513ecf5c2af85910cda4b97b16bca2f3854d45ea7504afaa2e7b7","documents/vendor/pypdf/_reader.py":"3d6716332ef3acc3189b77082512ae3750e7a13086efc7594d486eca2c7d4d88","documents/vendor/pypdf/_text_extraction/__init__.py":"edbd8ed7c7ca75cca17167f389806c1e9f878339f218968719b11c77cf2ae7cd","documents/vendor/pypdf/_text_extraction/_layout_mode/__init__.py":"935b4de3a8035f5ce101ab43f284c632e089529fa981b1e3c90f07e9ac574605","documents/vendor/pypdf/_text_extraction/_layout_mode/_fixed_width_page.py":"b9875c9cb1cd5554844e20dd4e0033ff6afd999413e2b5c0707365350ec34f54","documents/vendor/pypdf/_text_extraction/_layout_mode/_font.py":"677df87e97ed1d5111badd5cdeb8d6bc1e3d05d71a03f845ab766e58be70726d","documents/vendor/pypdf/_text_extraction/_layout_mode/_font_widths.py":"1df82c7767ed1b0f008e5ec873034895f2d89ee9be7a469a75fc04adc51d5ad2","documents/vendor/pypdf/_text_extraction/_layout_mode/_text_state_manager.py":"9c7e78f118ba0368f0204d29c2f8961d27da757f71365fa67ce439dfd4004642","documents/vendor/pypdf/_text_extraction/_layout_mode/_text_state_params.py":"6fc0d2a09d9e6ac0995bf26f325f3858514800d28684b0f5ce3315025a927325","documents/vendor/pypdf/_text_extraction/_text_extractor.py":"14a546b94cd4683de2bdf58de1506a6e14f9cc01278a457823dc4f2746d2c280","documents/vendor/pypdf/_utils.py":"2ecb9228f93b970ca294ff8e7d68599369854fce468f7c817ffebd7d5b1944f9","documents/vendor/pypdf/_version.py":"2bc4145aab739b446fcaf322d2c859bab95c6d11353221d8e37a092092dc185d","documents/vendor/pypdf/_writer.py":"283d074e99ac4e05c27ddcea63aa56d722a518dd219193e93c7ab3a58ddd5153","documents/vendor/pypdf/_xobj_image_helpers.py":"6f04d8fd732bb79b1b642283a49b1eff8ead439bfc5b2a88fa192f59ee62989f","documents/vendor/pypdf/annotations/__init__.py":"7f693ffa3027dfd0